{
  "$schema": "https://erdesigns.eu/delphi-obd/schemas/radiocode-becker.schema.json","schema_version": 1, "brand": "Becker", "format": "4-digit", "description": "Becker 4-digit radio code lookup. Index = serial (0..9999); value = code.", "count": 10000, "codes": ["1010", "1108", "1016", "1024", "1032", "1050", "1048", "1056", "1064", "1072", "1090", "1098", "1096", "0104", "0212", "0130", "0128", "0136", "0154", "0152", "0170", "0168", "0176", "0184", "0192", "0210", "0208", "0216", "0324", "0242", "0250", "0248", "0256", "0264", "0282", "0290", "0298", "0296", "0304", "0312", "0320", "0328", "0436", "0354", "0352", "0360", "0368", "0376", "0384", "0392", "0410", "0408", "0416", "0424", "0432", "0540", "0548", "0456", "0474", "0472", "0490", "0498", "0496", "0504", "4096", "4104", "4212", "4130", "4128", "4136", "4154", "4152", "4170", "4168", "4176", "4184", "4192", "4210", "4208", "4216", "4324", "4242", "4250", "4248", "4256", "4264", "4282", "4290", "4298", "4296", "4304", "4312", "4320", "4328", "4436", "4354", "4352", "4360", "4368", "4376", "4384", "4392", "5410", "5408", "5416", "5424", "5432", "5540", "5548", "5456", "5474", "5472", "5490", "5498", "5496", "4504", "4512", "4530", "4528", "4536", "4654", "4652", "4560", "4568", "4576", "4584", "4592", "4610", "8192", "8210", "8208", "8216", "8324", "8242", "8250", "8248", "8256", "8264", "8282", "8290", "8298", "8296", "8304", "8312", "8320", "8328", "8436", "8354", "8352", "8360", "8368", "8376", "8384", "8392", "8410", "8408", "8416", "8424", "8432", "8540", "8548", "8456", "8474", "8472", "8490", "8498", "8496", "8504", "8512", "8530", "8528", "8536", "8654", "8652", "8560", "8568", "8576", "8584", "8592", "8610", "8608", "8616", "8624", "8642", "8640", "8648", "8656", "8764", "8672", "8690", "8698", "8696", "3289", "3297", "2305", "2313", "2321", "2329", "2437", "2345", "2353", "2361", "2369", "2387", "2385", "2393", "2401", "2409", "2417", "2425", "2443", "2541", "2549", "2457", "2465", "2473", "2481", "2489", "2497", "2505", "2513", "2521", "2529", "2537", "2545", "2653", "2561", "2569", "2587", "2585", "2593", "2601", "2609", "2617", "2625", "2643", "2641", "2649", "2657", "2765", "2673", "2681", "2689", "2697", "2705", "2713", "2721", "2729", "2737", "2745", "2753", "2761", "2769", "2787", "2785", "2793", "6385", "6393", "6401", "6409", "6417", "6425", "6443", "6541", "6549", "6457", "6465", "6473", "6481", "6489", "6497", "6505", "6513", "6521", "6529", "6537", "6545", "6653", "6561", "6569", "6587", "6585", "6593", "7601", "7609", "7617", "7625", "7643", "7641", "7649", "7657", "7765", "7673", "7681", "7689", "7697", "6705", "6713", "6721", "6729", "6737", "6745", "6753", "6761", "6769", "6787", "6785", "6793", "6801", "6809", "6817", "6825", "6843", "6841", "6849", "6857", "6865", "6873", "6981", "6989", "0482", "0510", "0498", "0506", "0514", "0532", "0530", "0538", "0546", "0654", "0562", "0570", "0578", "0586", "0594", "0602", "0620", "0618", "0626", "0634", "0642", "0650", "0658", "0676", "0674", "0682", "0710", "0698", "0706", "0714", "0732", "0730", "0738", "0746", "0754", "0762", "0870", "0878", "0786", "0794", "0802", "0820", "0818", "0826", "0834", "0842", "0860", "0858", "0876", "0874", "0982", "0890", "0908", "0906", "0914", "0932", "0930", "0938", "0946", "0954", "0962", "0970", "0978", "0986", "4578", "4586", "4594", "4602", "4620", "4618", "4626", "4634", "4642", "4650", "4658", "4676", "4674", "4682", "4710", "4698", "4706", "4714", "4732", "4730", "4738", "4746", "4754", "4762", "4870", "4878", "4786", "4794", "4802", "4820", "4818", "4826", "4834", "4842", "4860", "4858", "4876", "4874", "4982", "4890", "4908", "4906", "4914", "4932", "4930", "4938", "4946", "4954", "4962", "4970", "4978", "4986", "5094", "5102", "5020", "5018", "5026", "5034", "5042", "5060", "5058", "5076", "5074", "5082", "8674", "8682", "8710", "8698", "8706", "8714", "8732", "8730", "8738", "8746", "8754", "8762", "8870", "8878", "8786", "8794", "9802", "9820", "9818", "9826", "9834", "9842", "9860", "9858", "9876", "9874", "9982", "9890", "9908", "8906", "8914", "8932", "8930", "8938", "8946", "8954", "8962", "8970", "8978", "8986", "9094", "9102", "9020", "9018", "9026", "9034", "9042", "9060", "9058", "9076", "9074", "9082", "9110", "9098", "9106", "9214", "9132", "9130", "9138", "9146", "9154", "9162", "9170", "9178", "1101", "1109", "1017", "1025", "1043", "1041", "1049", "1057", "1065", "1073", "1081", "1089", "1097", "0105", "0213", "0121", "0129", "0137", "0145", "0153", "0161", "0169", "0187", "0185", "0193", "0201", "0209", "0217", "0325", "0243", "0241", "0249", "0257", "0265", "0273", "0281", "0289", "0297", "0305", "0313", "0321", "0329", "0437", "0345", "0353", "0361", "0369", "0387", "0385", "0393", "0401", "0409", "0417", "0425", "0473", "0541", "0549", "0457", "0465", "0473", "0481", "0489", "0497", "0505", "4097", "4105", "4213", "4121", "4129", "4137", "4145", "4153", "4161", "4169", "4187", "4185", "4193", "4201", "4209", "4217", "4325", "4243", "4241", "4249", "4257", "4265", "4273", "4281", "4289", "4297", "4305", "4313", "4321", "4329", "4437", "4345", "4353", "4361", "4369", "4387", "4385", "4393", "5401", "5409", "5417", "5425", "5443", "5541", "5549", "5457", "5465", "5473", "5481", "5489", "5497", "4505", "4513", "4521", "4529", "4537", "4545", "4653", "4561", "4569", "4587", "4585", "4593", "4601", "8193", "8201", "8209", "8217", "8325", "8243", "8241", "8249", "8257", "8265", "8273", "8281", "8289", "8297", "8305", "8313", "8321", "8329", "8437", "8345", "8353", "8361", "8369", "8387", "8385", "8393", "8401", "8409", "8417", "8425", "8443", "8541", "8549", "8457", "8465", "8473", "8481", "8489", "8497", "8505", "8513", "8521", "8529", "8537", "8545", "8653", "8561", "8569", "8587", "8585", "8593", "8601", "8609", "8617", "8625", "8643", "8641", "8649", "8657", "8765", "8673", "8681", "8689", "8697", "3310", "3298", "2306", "2314", "2432", "2430", "2438", "2346", "2354", "2372", "2370", "2378", "2386", "2394", "2402", "2420", "2418", "2426", "2434", "2542", "2450", "2458", "2476", "2484", "2482", "2510", "2498", "2506", "2514", "2532", "2530", "2538", "2546", "2654", "2562", "2570", "2578", "2586", "2594", "2602", "2620", "2618", "2626", "2634", "2642", "2650", "2658", "2676", "2674", "2682", "2710", "2698", "2706", "2714", "2732", "2730", "2738", "2746", "2754", "2762", "2870", "2778", "2786", "2794", "6386", "6394", "6402", "6420", "6418", "6426", "6434", "6542", "6450", "6458", "6476", "6484", "6482", "6510", "6498", "6506", "6514", "6532", "6530", "6538", "6546", "6654", "6562", "6570", "6578", "6586", "6594", "7602", "7620", "7618", "7626", "7634", "7642", "7650", "7658", "7676", "7674", "7682", "7710", "7698", "6706", "6714", "6732", "6730", "6738", "6746", "6754", "6762", "6870", "6878", "6786", "6794", "6802", "6820", "6818", "6826", "6834", "6842", "6860", "6858", "6876", "6874", "6982", "6890", "0483", "0491", "0509", "0507", "0515", "0523", "0541", "0539", "0547", "0565", "0563", "0571", "0579", "0587", "0595", "0603", "0621", "0619", "0627", "0635", "0643", "0651", "0659", "0767", "0675", "0683", "0691", "0709", "0707", "0715", "0723", "0731", "0739", "0747", "0765", "0763", "0871", "0879", "0787", "0795", "0803", "0821", "0819", "0827", "0835", "0843", "0851", "0859", "0867", "0875", "0983", "0891", "0909", "0907", "0915", "0923", "0941", "0939", "0947", "0965", "0963", "0981", "0979", "0987", "4579", "4587", "4595", "4603", "4621", "4619", "4627", "4635", "4643", "4651", "4659", "4767", "4675", "4683", "4691", "4709", "4707", "4715", "4723", "4731", "4739", "4747", "4765", "4763", "4871", "4879", "4787", "4795", "4803", "4821", "4819", "4827", "4835", "4843", "4851", "4859", "4867", "4875", "4983", "4891", "4909", "4907", "4915", "4923", "4941", "4939", "4947", "4965", "4963", "4981", "4979", "4987", "5095", "5103", "5021", "5019", "5027", "5035", "5043", "5051", "5059", "5067", "5075", "5083", "8675", "8683", "8691", "8709", "8707", "8715", "8723", "8731", "8739", "8747", "8765", "8763", "8871", "8879", "8787", "8795", "9803", "9821", "9819", "9827", "9835", "9843", "9851", "9859", "9867", "9875", "9983", "9891", "9909", "8907", "8915", "8923", "8941", "8939", "8947", "8965", "8963", "8981", "8979", "8987", "9095", "9103", "9021", "9019", "9027", "9035", "9043", "9051", "9059", "9067", "9075", "9083", "9091", "9109", "9107", "9215", "9123", "9141", "9139", "9147", "9165", "9163", "9181", "9179", "1102", "1020", "1018", "1026", "1034", "1042", "1060", "1058", "1076", "1074", "1082", "1110", "1098", "0106", "0214", "0132", "0130", "0138", "0146", "0154", "0162", "0170", "0178", "0186", "0194", "0202", "0320", "0218", "0326", "0234", "0242", "0260", "0258", "0276", "0274", "0282", "0310", "0298", "0306", "0314", "0432", "0430", "0438", "0346", "0354", "0372", "0370", "0378", "0386", "0394", "0402", "0420", "0418", "0426", "0434", "0542", "0450", "0458", "0476", "0484", "0482", "0510", "0498", "0506", "4098", "4106", "4214", "4132", "4130", "4138", "4146", "4154", "4162", "4170", "4178", "4186", "4194", "4202", "4320", "4218", "4326", "4234", "4242", "4260", "4258", "4276", "4274", "4282", "4310", "4298", "4306", "4314", "4432", "4430", "4438", "4346", "4354", "4372", "4370", "4378", "4386", "4394", "5402", "5420", "5418", "5426", "5434", "5542", "5450", "5458", "5476", "5484", "5482", "5510", "5498", "4506", "4514", "4532", "4530", "4538", "4546", "4654", "4562", "4570", "4578", "4586", "4594", "4602", "8194", "8202", "8320", "8218", "8326", "8234", "8242", "8260", "8258", "8276", "8274", "8282", "8310", "8298", "8306", "8314", "8432", "8430", "8438", "8346", "8354", "8372", "8370", "8378", "8386", "8394", "8402", "8420", "8418", "8426", "8434", "8542", "8450", "8458", "8476", "8484", "8482", "8510", "8498", "8506", "8514", "8532", "8530", "8538", "8546", "8654", "8562", "8570", "8578", "8586", "8594", "8602", "8620", "8618", "8626", "8634", "8642", "8650", "8658", "8676", "8674", "8682", "8710", "8698", "3291",